FR Category,Requirement ID,Requirement Name,Requirement Description,Compliance Status (Met/Not Met/Unsure),Evidence from TVCS SAT Document,TVCS Implementation Status
FR5 - Restricted Data Flow,SR 5.1,Network segmentation,The control system shall provide the capability to logically segment control system network from other networks,Met,"Firewall with zone-based policies, multiple switches with network segmentation",Complete
FR5 - Restricted Data Flow,SR 5.1 RE(1),Physically separate networks,Physically separate control system network from non-control networks,Unsure,Logical segmentation via firewall/VLANs but physical separation not documented,Partial
FR5 - Restricted Data Flow,SR 5.2,Zone boundary protection,The control system shall provide the capability to monitor and control communications at zone boundaries,Met,"Firewalls (CEC-002-FW1, CEC-006-FW1) with HA, baseline security policies configured",Complete
FR5 - Restricted Data Flow,SR 5.2 RE(1),"Deny all, permit by exception",Deny network traffic by default and allow by exception,Unsure,Firewall policies configured but default-deny stance not explicitly confirmed,Partial
FR5 - Restricted Data Flow,SR 5.2 RE(2),Island mode operation,Operate in island mode when required,Unsure,HA firewalls can operate independently but island mode capability not documented,Partial
FR5 - Restricted Data Flow,SR 5.3,General purpose person-to-person communication restrictions,The control system shall provide the capability to prohibit or restrict general purpose person-to-person communication,Unsure,GPO restrictions on HMI prevent some functions but general communications not fully addressed,Partial
FR5 - Restricted Data Flow,SR 5.3 RE(1),Prohibit all general purpose person-to-person communications,Prohibit all general purpose person-to-person communications,Not Met,RDP and other admin access appears to be allowed,Not Met
FR5 - Restricted Data Flow,SR 5.4,Application partitioning,The control system shall provide the capability to separate user functionality from system management functionality,Met,"Separate VMs for different functions (Hyper-V hosts), HMI operator account restrictions (NET-2A-TC209)",Complete
