[2025-11-21 21:04:18] Creating constraints and indexes...
[2025-11-21 21:04:18]   ✓ CONSTRAINT
[2025-11-21 21:04:18]   ✓ CONSTRAINT
[2025-11-21 21:04:18]   ✓ CONSTRAINT
[2025-11-21 21:04:18]   ✓ CONSTRAINT
[2025-11-21 21:04:18]   ✓ CONSTRAINT
[2025-11-21 21:04:18]   ✓ CONSTRAINT
[2025-11-21 21:04:18]   ✓ CONSTRAINT
[2025-11-21 21:04:18]   ✓ CONSTRAINT
[2025-11-21 21:04:18]   ✓ INDEX
[2025-11-21 21:04:18]   ✓ INDEX
[2025-11-21 21:04:18]   ✓ INDEX
[2025-11-21 21:04:18]   ✓ INDEX
[2025-11-21 21:04:18]   ✓ INDEX
[2025-11-21 21:04:18]   ✓ INDEX
[2025-11-21 21:04:18]   ✓ INDEX
[2025-11-21 21:04:18] Constraints and indexes created successfully
[2025-11-21 21:04:18] Creating 3500 Device nodes in batches of 500...
[2025-11-21 21:04:19]   Batch 1/7: 500 nodes created
[2025-11-21 21:04:19]   Batch 2/7: 500 nodes created
[2025-11-21 21:04:19]   Batch 3/7: 500 nodes created
[2025-11-21 21:04:19]   Batch 4/7: 500 nodes created
[2025-11-21 21:04:19]   Batch 5/7: 500 nodes created
[2025-11-21 21:04:19]   Batch 6/7: 500 nodes created
[2025-11-21 21:04:19]   Batch 7/7: 500 nodes created
[2025-11-21 21:04:19] ✓ 3500 Device nodes created
[2025-11-21 21:04:19] Creating 17000 Measurement nodes in batches of 500...
[2025-11-21 21:04:19]   Batch 1/34: 500 nodes created
[2025-11-21 21:04:19]   Batch 2/34: 500 nodes created
[2025-11-21 21:04:19]   Batch 3/34: 500 nodes created
[2025-11-21 21:04:19]   Batch 4/34: 500 nodes created
[2025-11-21 21:04:19]   Batch 5/34: 500 nodes created
[2025-11-21 21:04:19]   Batch 6/34: 500 nodes created
[2025-11-21 21:04:19]   Batch 7/34: 500 nodes created
[2025-11-21 21:04:19]   Batch 8/34: 500 nodes created
[2025-11-21 21:04:19]   Batch 9/34: 500 nodes created
[2025-11-21 21:04:20]   Batch 10/34: 500 nodes created
[2025-11-21 21:04:20]   Batch 11/34: 500 nodes created
[2025-11-21 21:04:20]   Batch 12/34: 500 nodes created
[2025-11-21 21:04:20]   Batch 13/34: 500 nodes created
[2025-11-21 21:04:20]   Batch 14/34: 500 nodes created
[2025-11-21 21:04:20]   Batch 15/34: 500 nodes created
[2025-11-21 21:04:20]   Batch 16/34: 500 nodes created
[2025-11-21 21:04:20]   Batch 17/34: 500 nodes created
[2025-11-21 21:04:20]   Batch 18/34: 500 nodes created
[2025-11-21 21:04:20]   Batch 19/34: 500 nodes created
[2025-11-21 21:04:20]   Batch 20/34: 500 nodes created
[2025-11-21 21:04:20]   Batch 21/34: 500 nodes created
[2025-11-21 21:04:20]   Batch 22/34: 500 nodes created
[2025-11-21 21:04:20]   Batch 23/34: 500 nodes created
[2025-11-21 21:04:20]   Batch 24/34: 500 nodes created
[2025-11-21 21:04:20]   Batch 25/34: 500 nodes created
[2025-11-21 21:04:20]   Batch 26/34: 500 nodes created
[2025-11-21 21:04:20]   Batch 27/34: 500 nodes created
[2025-11-21 21:04:20]   Batch 28/34: 500 nodes created
[2025-11-21 21:04:20]   Batch 29/34: 500 nodes created
[2025-11-21 21:04:20]   Batch 30/34: 500 nodes created
[2025-11-21 21:04:20]   Batch 31/34: 500 nodes created
[2025-11-21 21:04:20]   Batch 32/34: 500 nodes created
[2025-11-21 21:04:21]   Batch 33/34: 500 nodes created
[2025-11-21 21:04:21]   Batch 34/34: 500 nodes created
[2025-11-21 21:04:21] ✓ 17000 Measurement nodes created
[2025-11-21 21:04:21] Creating 5000 Property nodes in batches of 500...
[2025-11-21 21:04:21]   Batch 1/10: 500 nodes created
[2025-11-21 21:04:21]   Batch 2/10: 500 nodes created
[2025-11-21 21:04:21]   Batch 3/10: 500 nodes created
[2025-11-21 21:04:21]   Batch 4/10: 500 nodes created
[2025-11-21 21:04:21]   Batch 5/10: 500 nodes created
[2025-11-21 21:04:21]   Batch 6/10: 500 nodes created
[2025-11-21 21:04:21]   Batch 7/10: 500 nodes created
[2025-11-21 21:04:21]   Batch 8/10: 500 nodes created
[2025-11-21 21:04:21]   Batch 9/10: 500 nodes created
[2025-11-21 21:04:21]   Batch 10/10: 500 nodes created
[2025-11-21 21:04:21] ✓ 5000 Property nodes created
[2025-11-21 21:04:21] Creating 1200 Process nodes in batches of 500...
[2025-11-21 21:04:21]   Batch 1/3: 500 nodes created
[2025-11-21 21:04:21]   Batch 2/3: 500 nodes created
[2025-11-21 21:04:21]   Batch 3/3: 200 nodes created
[2025-11-21 21:04:21] ✓ 1200 Process nodes created
[2025-11-21 21:04:21] Creating 600 Control nodes in batches of 500...
[2025-11-21 21:04:21]   Batch 1/2: 500 nodes created
[2025-11-21 21:04:21]   Batch 2/2: 100 nodes created
[2025-11-21 21:04:21] ✓ 600 Control nodes created
[2025-11-21 21:04:21] Creating 400 Alert nodes in batches of 500...
[2025-11-21 21:04:21]   Batch 1/1: 400 nodes created
[2025-11-21 21:04:21] ✓ 400 Alert nodes created
[2025-11-21 21:04:21] Creating 250 Zone nodes in batches of 500...
[2025-11-21 21:04:21]   Batch 1/1: 250 nodes created
[2025-11-21 21:04:21] ✓ 250 Zone nodes created
[2025-11-21 21:04:21] Creating 50 Asset nodes in batches of 500...
[2025-11-21 21:04:21]   Batch 1/1: 50 nodes created
[2025-11-21 21:04:21] ✓ 50 Asset nodes created
[2025-11-21 21:04:21] Creating relationships...
[2025-11-21 21:04:21]   Creating MONITORS relationships (Device -> Measurement)...
[2025-11-21 21:04:21]     Batch 1/17: 1000 MONITORS relationships
[2025-11-21 21:04:21]     Batch 2/17: 1000 MONITORS relationships
[2025-11-21 21:04:21]     Batch 3/17: 1000 MONITORS relationships
[2025-11-21 21:04:21]     Batch 4/17: 1000 MONITORS relationships
[2025-11-21 21:04:21]     Batch 5/17: 1000 MONITORS relationships
[2025-11-21 21:04:21]     Batch 6/17: 1000 MONITORS relationships
[2025-11-21 21:04:22]     Batch 7/17: 1000 MONITORS relationships
[2025-11-21 21:04:22]     Batch 8/17: 1000 MONITORS relationships
[2025-11-21 21:04:22]     Batch 9/17: 1000 MONITORS relationships
[2025-11-21 21:04:22]     Batch 10/17: 1000 MONITORS relationships
[2025-11-21 21:04:22]     Batch 11/17: 1000 MONITORS relationships
[2025-11-21 21:04:22]     Batch 12/17: 1000 MONITORS relationships
[2025-11-21 21:04:22]     Batch 13/17: 1000 MONITORS relationships
[2025-11-21 21:04:22]     Batch 14/17: 1000 MONITORS relationships
[2025-11-21 21:04:22]     Batch 15/17: 1000 MONITORS relationships
[2025-11-21 21:04:22]     Batch 16/17: 1000 MONITORS relationships
[2025-11-21 21:04:22]     Batch 17/17: 1000 MONITORS relationships
[2025-11-21 21:04:22]   Creating HAS_PROPERTY relationships (Device -> Property)...
[2025-11-21 21:04:22]     Batch 1/5: 1000 HAS_PROPERTY relationships
[2025-11-21 21:04:22]     Batch 2/5: 1000 HAS_PROPERTY relationships
[2025-11-21 21:04:22]     Batch 3/5: 1000 HAS_PROPERTY relationships
[2025-11-21 21:04:22]     Batch 4/5: 1000 HAS_PROPERTY relationships
[2025-11-21 21:04:22]     Batch 5/5: 1000 HAS_PROPERTY relationships
[2025-11-21 21:04:22]   Creating EXECUTES relationships (Device -> Process)...
[2025-11-21 21:04:22]     Batch 1/4: 1000 EXECUTES relationships
[2025-11-21 21:04:22]     Batch 2/4: 1000 EXECUTES relationships
[2025-11-21 21:04:22]     Batch 3/4: 1000 EXECUTES relationships
[2025-11-21 21:04:22]     Batch 4/4: 600 EXECUTES relationships
[2025-11-21 21:04:22]   Creating CONTROLS relationships (Control -> Device)...
[2025-11-21 21:04:22]     Batch 1/4: 1000 CONTROLS relationships
[2025-11-21 21:04:22]     Batch 2/4: 1000 CONTROLS relationships
[2025-11-21 21:04:22]     Batch 3/4: 1000 CONTROLS relationships
[2025-11-21 21:04:22]     Batch 4/4: 600 CONTROLS relationships
[2025-11-21 21:04:22]   Creating TRIGGERS relationships (Measurement -> Alert)...
[2025-11-21 21:04:22]     Batch 1/1: 800 TRIGGERS relationships
[2025-11-21 21:04:22]   Creating LOCATED_IN relationships (Device -> Zone)...
[2025-11-21 21:04:22]     Batch 1/4: 1000 LOCATED_IN relationships
[2025-11-21 21:04:23]     Batch 2/4: 1000 LOCATED_IN relationships
[2025-11-21 21:04:23]     Batch 3/4: 1000 LOCATED_IN relationships
[2025-11-21 21:04:23]     Batch 4/4: 500 LOCATED_IN relationships
[2025-11-21 21:04:23]   Creating SUPPORTS relationships (Asset -> Device)...
[2025-11-21 21:04:23]     Batch 1/4: 1000 SUPPORTS relationships
[2025-11-21 21:04:23]     Batch 2/4: 1000 SUPPORTS relationships
[2025-11-21 21:04:23]     Batch 3/4: 1000 SUPPORTS relationships
[2025-11-21 21:04:23]     Batch 4/4: 500 SUPPORTS relationships
[2025-11-21 21:04:23]   Creating REPORTS_TO relationships (Device -> Control)...
[2025-11-21 21:04:23]     Batch 1/4: 1000 REPORTS_TO relationships
[2025-11-21 21:04:23]     Batch 2/4: 1000 REPORTS_TO relationships
[2025-11-21 21:04:23]     Batch 3/4: 1000 REPORTS_TO relationships
[2025-11-21 21:04:23]     Batch 4/4: 500 REPORTS_TO relationships
[2025-11-21 21:04:23]   Creating REQUIRES relationships (Process -> Device)...
[2025-11-21 21:04:23]     Batch 1/5: 1000 REQUIRES relationships
[2025-11-21 21:04:23]     Batch 2/5: 1000 REQUIRES relationships
[2025-11-21 21:04:23]     Batch 3/5: 1000 REQUIRES relationships
[2025-11-21 21:04:23]     Batch 4/5: 1000 REQUIRES relationships
[2025-11-21 21:04:23]     Batch 5/5: 777 REQUIRES relationships
[2025-11-21 21:04:23] ✓ All relationships created
[2025-11-21 21:04:23] Validating deployment...
[2025-11-21 21:04:23]   total_nodes: 28000
[2025-11-21 21:04:23]   device_nodes: 3500
[2025-11-21 21:04:23]   measurement_nodes: 17000
[2025-11-21 21:04:23]   property_nodes: 5000
[2025-11-21 21:04:23]   process_nodes: 1200
[2025-11-21 21:04:23]   control_nodes: 600
[2025-11-21 21:04:23]   alert_nodes: 400
[2025-11-21 21:04:23]   zone_nodes: 250
[2025-11-21 21:04:23]   asset_nodes: 50
[2025-11-21 21:04:25]   total_relationships: 45277

================================================================================
VALIDATION RESULTS
================================================================================
total_nodes: 28000
device_nodes: 3500
measurement_nodes: 17000
property_nodes: 5000
process_nodes: 1200
control_nodes: 600
alert_nodes: 400
zone_nodes: 250
asset_nodes: 50
total_relationships: 45277
