Beat,Timestamp,Actor,Role,Instrument_DISC,Pitch_Sentiment,Duration,Volume,Text,Lacan_Register,Psychometric_Note
1.0,00:00:00,Willy Loman,Salesman,Cello (S/C - Exhausted),C3 (Low/Weary),4.0,mp,"(Enter Willy Loman. He is past sixty years of age, dressed quietly...)",Real (The Body),Physical Exhaustion
1.5,00:00:05,Willy Loman,Salesman,Cello (S/C),G2 (Sigh),2.0,p,"It's all right. I came back.",Imaginary (Denial),Trying to maintain the Ego
2.0,00:00:10,Linda Loman,Wife,Flute (S - Supportive),E4 (Concern),1.0,mf,"Why? What happened? Did something happen, Willy?",Symbolic (The Question),Anxiety/Care
2.5,00:00:15,Willy Loman,Salesman,Cello (S/C),C3 (Flat),1.0,mp,"No, nothing happened.",Imaginary (Lie),Denial of the Real
3.0,00:00:20,Linda Loman,Wife,Flute (S),F4 (Rising),0.5,mf,"You didn't smash the car, did you?",Real (Trauma),Fear of the Crash
3.5,00:00:25,Willy Loman,Salesman,Trombone (D - Defensive),A3 (Sharp),0.5,f,"I said nothing happened. Didn't you hear me?",Imaginary (Aggression),Defensive Reaction (D-style)
4.0,00:00:30,Linda Loman,Wife,Flute (S),D4 (Soothing),2.0,p,"Don't you feel well?",Symbolic (Care),Attempting to restore homeostasis
4.5,00:00:35,Willy Loman,Salesman,Cello (S/C),B2 (Dissonant),3.0,mp,"I'm tired to the death. I couldn't make it. I just couldn't make it, Linda.",Real (The Void),Admission of Failure (The Death Drive)
5.0,00:00:45,System,Chorus,Strings (Background),G Major,4.0,pp,"(The flute plays on. He hears it but is not aware of it.)",Imaginary (Fantasy),The Incidental Music of the Past